<?xml version="1.0" encoding="utf-8"?>
<crawlerconfigs xmlns:xsi="http://www.w3.org/2001/XMLSchema-instance"
	xmlns="http://xmlschema.vfire.cn/xsd/crawlerconfigs" xsi:schemaLocation="http://xmlschema.vfire.cn/xsd/crawlerconfigs crawler-config-3.0.xsd">

	<!-- 0个 多个 -->
	<formatclass id="DemoDataFormat"
		class="cn.vfire.web.collector.tools.crawlerconfigxml.format.impl.DefaultDataFormat" />

	<!-- 1个 -->
	<proxyip id="proxyipid">
		<ip>10.0.0.1:8080</ip>
		<ip>10.0.0.3:8080</ip>
		<ip>10.0.0.2:8080</ip>
	</proxyip>

	<!-- 0个 多个 -->
	<outfile id="outfile">
		<prefix>suffix</prefix>
		<suffix>.${sn}.txt</suffix>
		<name>${selecter.selecter2.selecter1}</name>
		<path>/${selecter.selecter2.selecter1}/</path>
	</outfile>

	<!-- 多个 -->
	<outdata id="outdataid">
		<formatclass ref="DemoDataFormat" />
		<outfile ref="outfile" />
	</outdata>

	<!-- 1个 -->
	<crawlerconfig id="crawlerJob" depth="1" incthreads="5" isproxy="false"
		maxexecutecount="5" maxthreads="50" minthreads="5" retry="1" threads="5"
		topnum="-1">

		<name>采集任务</name>
		<description>采集描述</description>
		<seedurl>中文url</seedurl>
		<regexrules>
			<regex>aaa</regex>
			<regex>bbb</regex>
			<regex>ccc</regex>
		</regexrules>
		<unregexrules>
			<regex>aaa</regex>
			<regex>bbb</regex>
			<regex>ccc</regex>
		</unregexrules>

		<datamode id="datamode1" selecter="selecter">
			<urls>
				<regex>aaa</regex>
				<regex>bbb</regex>
				<regex>ccc</regex>
			</urls>
			<outdata ref="outdataid" />
			<node key="name1" value="123456" />
			<node key="data" selecter="selecter2">
				<node key="key1" selecter="selecter.selecter2.selecter1"></node>
				<node key="key2" selecter="selecter.selecter2.selecter2"></node>
				<node key="key3" selecter="selecter.selecter2.selecter3"></node>
				<list key="data" selecter="selecter.selecter2.selecter4">
					<node selecter="selecter.selecter2.selecter3.1"></node>
					<node selecter="selecter.selecter2.selecter3.2"></node>
					<node selecter="selecter.selecter2.selecter3.3"></node>
				</list>
			</node>
		</datamode>

		<datamode id="datamode2" selecter="selecter">
			<urls>
				<regex>aaa2</regex>
				<regex>bbb2</regex>
				<regex>ccc2</regex>
			</urls>
			<outdata ref="outdataid" />
			<node key="name1" value="123456" />
			<node key="data" selecter="selecter2">
				<node key="key1" selecter="selecter.selecter2.selecter1"></node>
				<node key="key2" selecter="selecter.selecter2.selecter2"></node>
				<node key="key3" selecter="selecter.selecter2.selecter3"></node>
				<list key="data" selecter="selecter.selecter2.selecter4">
					<node selecter="selecter.selecter2.selecter3.1"></node>
					<node selecter="selecter.selecter2.selecter3.2"></node>
					<node selecter="selecter.selecter2.selecter3.3"></node>
				</list>
			</node>
		</datamode>

	</crawlerconfig>







</crawlerconfigs>